{
  "schema_version": 4,
  "timezone": "Asia/Shanghai",
  "latest_date": "2026-10-21",
  "generated_at": "2026-10-21T00:00:00+08:00",
  "updated_display": "Updated Oct 21",
  "weeks": [
    {
      "week": "2026-W43",
      "start": "2026-10-19",
      "end": "2026-10-25",
      "view": {
        "week": "2026-W43",
        "start": "2026-10-19",
        "end": "2026-10-25",
        "range_display": "Oct 19 – Oct 25",
        "basis": "tokens",
        "requests": 2180,
        "tokens_total": 298756494,
        "cost_cents": 12942.8835,
        "tokens_display": "298.8M",
        "cost_display": "$129.43",
        "requests_display": "2,180",
        "breakdown": [
          {
            "kind": "tokens_in",
            "label": "Input",
            "amount": 28721132,
            "display": "28.7M",
            "pct": 9.613559061246715
          },
          {
            "kind": "tokens_out",
            "label": "Output",
            "amount": 1308867,
            "display": "1.3M",
            "pct": 0.4381049537955818
          },
          {
            "kind": "cache_write",
            "label": "Cache write",
            "amount": 2883777,
            "display": "2.9M",
            "pct": 0.9652600220967916
          },
          {
            "kind": "cache_read",
            "label": "Cache read",
            "amount": 265842718,
            "display": "265.8M",
            "pct": 88.98307596286091
          }
        ],
        "models": [
          {
            "label": "gemini-4-argon-medium",
            "requests": 424,
            "tokens_total": 89036350,
            "cost_cents": 3911.187,
            "tokens_display": "89.0M",
            "cost_display": "$39.11",
            "requests_display": "424",
            "pct": 29.802314523077783
          },
          {
            "label": "gpt-6.1-sol",
            "requests": 284,
            "tokens_total": 53292464,
            "cost_cents": 957.6886000000001,
            "tokens_display": "53.3M",
            "cost_display": "$9.58",
            "requests_display": "284",
            "pct": 17.838093922738295
          },
          {
            "label": "claude-sonnet-5-5-high",
            "requests": 225,
            "tokens_total": 33706927,
            "cost_cents": 911.3293000000001,
            "tokens_display": "33.7M",
            "cost_display": "$9.11",
            "requests_display": "225",
            "pct": 11.282408140724801
          },
          {
            "label": "gemini-4-argon-high",
            "requests": 177,
            "tokens_total": 31969664,
            "cost_cents": 1196.8221,
            "tokens_display": "32.0M",
            "cost_display": "$11.97",
            "requests_display": "177",
            "pct": 10.700910153270174
          },
          {
            "label": "grok-bot-default",
            "requests": 437,
            "tokens_total": 26302690,
            "cost_cents": 1995.0752,
            "tokens_display": "26.3M",
            "cost_display": "$19.95",
            "requests_display": "437",
            "pct": 8.804056322872768
          },
          {
            "label": "claude-opus-5-5-medium",
            "requests": 92,
            "tokens_total": 23070094,
            "cost_cents": 1413.2293,
            "tokens_display": "23.1M",
            "cost_display": "$14.13",
            "requests_display": "92",
            "pct": 7.72203934084191
          }
        ],
        "days": [
          {
            "date": "2026-10-19",
            "weekday": "Mon",
            "requests": 552,
            "tokens_total": 73916781,
            "cost_cents": 4543.2658,
            "tokens_display": "73.9M"
          },
          {
            "date": "2026-10-20",
            "weekday": "Tue",
            "requests": 1032,
            "tokens_total": 133806922,
            "cost_cents": 4435.6768,
            "tokens_display": "133.8M"
          },
          {
            "date": "2026-10-21",
            "weekday": "Wed",
            "requests": 596,
            "tokens_total": 91032791,
            "cost_cents": 3963.9409,
            "tokens_display": "91.0M"
          },
          {
            "date": "2026-10-22",
            "weekday": "Thu",
            "requests": 0,
            "tokens_total": null,
            "cost_cents": null,
            "tokens_display": "—"
          },
          {
            "date": "2026-10-23",
            "weekday": "Fri",
            "requests": 0,
            "tokens_total": null,
            "cost_cents": null,
            "tokens_display": "—"
          },
          {
            "date": "2026-10-24",
            "weekday": "Sat",
            "requests": 0,
            "tokens_total": null,
            "cost_cents": null,
            "tokens_display": "—"
          },
          {
            "date": "2026-10-25",
            "weekday": "Sun",
            "requests": 0,
            "tokens_total": null,
            "cost_cents": null,
            "tokens_display": "—"
          }
        ]
      }
    },
    {
      "week": "2026-W42",
      "start": "2026-10-12",
      "end": "2026-10-18",
      "view": {
        "week": "2026-W42",
        "start": "2026-10-12",
        "end": "2026-10-18",
        "range_display": "Oct 12 – Oct 18",
        "basis": "tokens",
        "requests": 8141,
        "tokens_total": 956755734,
        "cost_cents": 44607.3947,
        "tokens_display": "956.8M",
        "cost_display": "$446.07",
        "requests_display": "8,141",
        "breakdown": [
          {
            "kind": "tokens_in",
            "label": "Input",
            "amount": 42735593,
            "display": "42.7M",
            "pct": 4.466719297446091
          },
          {
            "kind": "tokens_out",
            "label": "Output",
            "amount": 4891020,
            "display": "4.9M",
            "pct": 0.5112088515583435
          },
          {
            "kind": "cache_write",
            "label": "Cache write",
            "amount": 22832296,
            "display": "22.8M",
            "pct": 2.386428969131216
          },
          {
            "kind": "cache_read",
            "label": "Cache read",
            "amount": 886296825,
            "display": "886.3M",
            "pct": 92.63564288186434
          }
        ],
        "models": [
          {
            "label": "gpt-6.1-sol",
            "requests": 1396,
            "tokens_total": 229619473,
            "cost_cents": 3707.1642,
            "tokens_display": "229.6M",
            "cost_display": "$37.07",
            "requests_display": "1,396",
            "pct": 23.99980108193425
          },
          {
            "label": "grok-bot-default",
            "requests": 2326,
            "tokens_total": 166398652,
            "cost_cents": 11280.218,
            "tokens_display": "166.4M",
            "cost_display": "$112.80",
            "requests_display": "2,326",
            "pct": 17.391968094543973
          },
          {
            "label": "grok-4.7-high",
            "requests": 849,
            "tokens_total": 107948960,
            "cost_cents": 6896.4594,
            "tokens_display": "107.9M",
            "cost_display": "$68.96",
            "requests_display": "849",
            "pct": 11.282812965090628
          },
          {
            "label": "claude-sonnet-5-5-high",
            "requests": 695,
            "tokens_total": 104834124,
            "cost_cents": 3361.6638,
            "tokens_display": "104.8M",
            "cost_display": "$33.62",
            "requests_display": "695",
            "pct": 10.957250662267784
          },
          {
            "label": "claude-opus-5-5-medium",
            "requests": 225,
            "tokens_total": 92636917,
            "cost_cents": 5829.9687,
            "tokens_display": "92.6M",
            "cost_display": "$58.30",
            "requests_display": "225",
            "pct": 9.682399980264973
          },
          {
            "label": "grok-4.7-medium",
            "requests": 166,
            "tokens_total": 31520156,
            "cost_cents": 1823.8944000000001,
            "tokens_display": "31.5M",
            "cost_display": "$18.24",
            "requests_display": "166",
            "pct": 3.294483103667503
          }
        ],
        "days": [
          {
            "date": "2026-10-12",
            "weekday": "Mon",
            "requests": 1151,
            "tokens_total": 147522028,
            "cost_cents": 7113.9586,
            "tokens_display": "147.5M"
          },
          {
            "date": "2026-10-13",
            "weekday": "Tue",
            "requests": 983,
            "tokens_total": 120930800,
            "cost_cents": 8857.8687,
            "tokens_display": "120.9M"
          },
          {
            "date": "2026-10-14",
            "weekday": "Wed",
            "requests": 739,
            "tokens_total": 93701489,
            "cost_cents": 3495.622,
            "tokens_display": "93.7M"
          },
          {
            "date": "2026-10-15",
            "weekday": "Thu",
            "requests": 2936,
            "tokens_total": 360366596,
            "cost_cents": 14771.2311,
            "tokens_display": "360.4M"
          },
          {
            "date": "2026-10-16",
            "weekday": "Fri",
            "requests": 1511,
            "tokens_total": 150910814,
            "cost_cents": 7265.0494,
            "tokens_display": "150.9M"
          },
          {
            "date": "2026-10-17",
            "weekday": "Sat",
            "requests": 602,
            "tokens_total": 76094850,
            "cost_cents": 2564.25,
            "tokens_display": "76.1M"
          },
          {
            "date": "2026-10-18",
            "weekday": "Sun",
            "requests": 219,
            "tokens_total": 7229157,
            "cost_cents": 539.4149,
            "tokens_display": "7.2M"
          }
        ]
      }
    },
    {